text,intent
Is travel insurance included in the ticket price?,generic_query
Can I book a flight with multiple destinations?,generic_query
How can I apply for a travel visa through the airline?,generic_query
What happens if my baggage is overweight?,generic_query
Are there mobile apps for flight status tracking?,generic_query
Can I pre-order duty-free items on board?,generic_query
What are the policies for emergency exits seating?,generic_query
How do I register for flight alerts?,generic_query
Can I check my child’s seat for safety regulations?,generic_query
What should I do if my baggage is damaged?,generic_query
Is there a direct flight to my destination?,generic_query
How do I book flights with flexible dates?,generic_query
Can I cancel my flight within 24 hours?,generic_query
What is the cancellation fee for international flights?,generic_query
Are there exclusive deals for students?,generic_query
How can I rebook a missed flight?,generic_query
How do I track my layover times?,generic_query
Are pets allowed in the cabin or cargo hold?,generic_query
Can I request an interpreter for international flights?,generic_query
What should I do if my flight is overbooked?,generic_query
Can you help me book a ticket?,generic_query
Can you help me cancel my booking?,generic_query
Can you help me change my flight time?,generic_query
Can you tell me baggage policies?,generic_query
